{
  "document_type": "solicitation",
  "confidence": 0.97,
  "evidence_excerpt": "Program Solicitation NSF 24-517 — Growing Research Access for Nationally Transformative Equity and Diversity (GRANTED)",
  "rationale": "Document is headed with the canonical self-identifying phrase 'Program Solicitation' followed by an NSF announcement number and program title, and the body is directed at prospective applicants with deadlines, eligibility, and merit review criteria.",
  "secondary_candidates": []
}
